{
  "grain_id": "CWSP",
  "grain_name": "Canada Western Special Purpose",
  "kind": "wheat",
  "region": "western",
  "use_class": null,
  "variety_tracks": null,
  "colour_modifier": false,
  "size_modifier": false,
  "source_url": "https://www.grainscanada.gc.ca/en/grain-quality/official-grain-grading-guide/04-wheat/primary-grade-determination/cwsp-wheat.html",
  "effective_crop_year": "2025/26",
  "last_scraped": "2026-08-01T20:47:06Z",
  "coverage_status": "complete",
  "fallthrough_label": "Grade, if No. 2 specs not met",
  "grade_floor_rules": [],
  "grades": ["No. 1 CWSP", "No. 2 CWSP"],
  "factor_groups": [
    {
      "group_id": "standard_of_quality",
      "group_label": "Standard of quality",
      "factors": [
        {
          "factor_id": "minimum_test_weight",
          "factor_label": "Minimum test weight",
          "unit": "kg/hL",
          "unit_alt": "g/0.5 L",
          "threshold_direction": "minimum",
          "is_aggregate": false,
          "aggregates": null,
          "footnote_ref": null,
          "thresholds": {
            "No. 1 CWSP": { "value_type": "numeric", "value": 72.0, "value_alt": 350.0, "threshold_note": null },
            "No. 2 CWSP": { "value_type": "numeric", "value": 65.0, "value_alt": 315.0, "threshold_note": null }
          },
          "fallthrough": "Wheat, Sample Canada Western (CW) Account Light Weight"
        },
        {
          "factor_id": "variety",
          "factor_label": "Variety",
          "unit": null,
          "unit_alt": null,
          "threshold_direction": null,
          "is_aggregate": false,
          "aggregates": null,
          "footnote_ref": null,
          "thresholds": {
            "No. 1 CWSP": { "value_type": "qualitative", "value": "Any variety of the class CWSP designated as such by order of the Commission", "value_alt": null, "threshold_note": null },
            "No. 2 CWSP": { "value_type": "qualitative", "value": "Any variety of the class CWSP designated as such by order of the Commission", "value_alt": null, "threshold_note": null }
          },
          "fallthrough": null
        }
      ]
    },
    {
      "group_id": "foreign_material",
      "group_label": "Foreign material",
      "factors": [
        {
          "factor_id": "ergot",
          "factor_label": "Ergot",
          "unit": "%",
          "unit_alt": null,
          "threshold_direction": "maximum",
          "is_aggregate": false,
          "aggregates": null,
          "footnote_ref": null,
          "thresholds": {
            "No. 1 CWSP": { "value_type": "numeric", "value": 0.1, "value_alt": null, "threshold_note": null },
            "No. 2 CWSP": { "value_type": "numeric", "value": 0.1, "value_alt": null, "threshold_note": null }
          },
          "fallthrough": "Wheat, Sample CW Account Ergot"
        },
        {
          "factor_id": "excreta",
          "factor_label": "Excreta",
          "unit": "%",
          "unit_alt": null,
          "threshold_direction": "maximum",
          "is_aggregate": false,
          "aggregates": null,
          "footnote_ref": null,
          "thresholds": {
            "No. 1 CWSP": { "value_type": "numeric", "value": 0.03, "value_alt": null, "threshold_note": null },
            "No. 2 CWSP": { "value_type": "numeric", "value": 0.03, "value_alt": null, "threshold_note": null }
          },
          "fallthrough": "Wheat, Sample CW Account Excreta"
        },
        {
          "factor_id": "stones",
          "factor_label": "Stones",
          "unit": "%",
          "unit_alt": null,
          "threshold_direction": "maximum",
          "is_aggregate": false,
          "aggregates": null,
          "footnote_ref": null,
          "thresholds": {
            "No. 1 CWSP": { "value_type": "numeric", "value": 0.03, "value_alt": null, "threshold_note": null },
            "No. 2 CWSP": { "value_type": "numeric", "value": 0.06, "value_alt": null, "threshold_note": null }
          },
          "fallthrough": [
            { "condition": "<= 2.5%", "region": null, "grade": "Rejected (grade) Account Stones" },
            { "condition": "> 2.5%", "region": null, "grade": "Wheat, Sample Salvage" }
          ]
        },
        {
          "factor_id": "total_foreign_material",
          "factor_label": "Total % Foreign material",
          "unit": "%",
          "unit_alt": null,
          "threshold_direction": "maximum",
          "is_aggregate": true,
          "aggregates": ["ergot", "excreta", "stones"],
          "footnote_ref": null,
          "thresholds": {
            "No. 1 CWSP": { "value_type": "numeric", "value": 5.0, "value_alt": null, "threshold_note": null },
            "No. 2 CWSP": { "value_type": "numeric", "value": 10.0, "value_alt": null, "threshold_note": null }
          },
          "fallthrough": "See Mixed grain"
        }
      ]
    },
    {
      "group_id": "grading_factors",
      "group_label": "Grading factors",
      "factors": [
        {
          "factor_id": "heated",
          "factor_label": "Heated",
          "unit": "%",
          "unit_alt": null,
          "threshold_direction": "maximum",
          "is_aggregate": false,
          "aggregates": null,
          "footnote_ref": null,
          "thresholds": {
            "No. 1 CWSP": { "value_type": "numeric", "value": 2.5, "value_alt": null, "threshold_note": null },
            "No. 2 CWSP": { "value_type": "numeric", "value": 2.5, "value_alt": null, "threshold_note": null }
          },
          "fallthrough": "Wheat, Sample CW Account Heated"
        },
        {
          "factor_id": "fusarium_damage",
          "factor_label": "Fusarium damage",
          "unit": "%",
          "unit_alt": null,
          "threshold_direction": "maximum",
          "is_aggregate": false,
          "aggregates": null,
          "footnote_ref": null,
          "thresholds": {
            "No. 1 CWSP": { "value_type": "numeric", "value": 1.0, "value_alt": null, "threshold_note": null },
            "No. 2 CWSP": { "value_type": "numeric", "value": 4.0, "value_alt": null, "threshold_note": null }
          },
          "fallthrough": [
            { "condition": "<= 10%", "region": null, "grade": "Wheat, Sample CW Account Fusarium Damage" },
            { "condition": "> 10%", "region": null, "grade": "Wheat, Commercial Salvage" }
          ]
        },
        {
          "factor_id": "artificial_stain_no_residue",
          "factor_label": "Artificial stain, no residue",
          "unit": "%",
          "unit_alt": null,
          "threshold_direction": "maximum",
          "is_aggregate": false,
          "aggregates": null,
          "footnote_ref": null,
          "thresholds": {
            "No. 1 CWSP": { "value_type": "numeric", "value": 2.0, "value_alt": null, "threshold_note": null },
            "No. 2 CWSP": { "value_type": "numeric", "value": 2.0, "value_alt": null, "threshold_note": null }
          },
          "fallthrough": "Wheat, Sample CW Account Stained Kernels"
        },
        {
          "factor_id": "fireburnt",
          "factor_label": "Fireburnt",
          "unit": "%",
          "unit_alt": null,
          "threshold_direction": "maximum",
          "is_aggregate": false,
          "aggregates": null,
          "footnote_ref": null,
          "thresholds": {
            "No. 1 CWSP": { "value_type": "numeric", "value": 2.0, "value_alt": null, "threshold_note": null },
            "No. 2 CWSP": { "value_type": "numeric", "value": 2.0, "value_alt": null, "threshold_note": null }
          },
          "fallthrough": "Wheat, Sample CW Account Fireburnt"
        },
        {
          "factor_id": "broken",
          "factor_label": "Broken",
          "unit": "%",
          "unit_alt": null,
          "threshold_direction": "maximum",
          "is_aggregate": false,
          "aggregates": null,
          "footnote_ref": null,
          "thresholds": {
            "No. 1 CWSP": { "value_type": "numeric", "value": 13.0, "value_alt": null, "threshold_note": null },
            "No. 2 CWSP": { "value_type": "numeric", "value": 50.0, "value_alt": null, "threshold_note": null }
          },
          "fallthrough": "Sample Broken Grain"
        }
      ]
    }
  ],
  "footnotes": null
}
